{
  "$schema": "https://json-schema.org/draft/2020-12/schema",
  "$id": "urn:dsh-community-market:schema:catalog-source:1.1.0",
  "title": "DSH Community Market catalog source manifest",
  "description": "A provider-neutral declaration for one user-selectable JSON catalog endpoint (standard-port HTTPS or loopback HTTP on 127.0.0.1, ::1 or localhost). A user registers its manifest URL; selection and all other user-owned state stay local. The smallest recommended profile supports q, category, cursor, and limit and uses 50 as an example page size, not a global cap.",
  "type": "object",
  "additionalProperties": false,
  "required": [
    "manifestVersion",
    "providerId",
    "name",
    "attribution",
    "transport",
    "query"
  ],
  "properties": {
    "manifestVersion": {
      "type": "string",
      "pattern": "^1\\.(0|[1-9][0-9]*)\\.(0|[1-9][0-9]*)(?:-(?:0|[1-9][0-9]*|[0-9]*[A-Za-z-][0-9A-Za-z-]*)(?:\\.(?:0|[1-9][0-9]*|[0-9]*[A-Za-z-][0-9A-Za-z-]*))*)?(?:\\+[0-9A-Za-z-]+(?:\\.[0-9A-Za-z-]+)*)?$(?![\\s\\S])",
      "description": "Valid SemVer with major 1. Minor and patch additions preserve the validated shape; other majors are refused."
    },
    "providerId": {
      "type": "string",
      "minLength": 3,
      "maxLength": 128,
      "pattern": "^[a-z0-9]+(?:[.-][a-z0-9]+)+$",
      "description": "Provider-claimed stable identifier, preferably in reverse-domain form. The Host generates a separate sourceRecordId for local identity."
    },
    "name": {
      "type": "string",
      "minLength": 1,
      "maxLength": 120,
      "pattern": "^[^\\u0000-\\u001F\\u007F-\\u009F\\u202A-\\u202E\\u2066-\\u2069]*$"
    },
    "description": {
      "type": "string",
      "maxLength": 500,
      "pattern": "^[^\\u0000-\\u001F\\u007F-\\u009F\\u202A-\\u202E\\u2066-\\u2069]*$"
    },
    "homepage": {
      "type": "string",
      "format": "uri",
      "maxLength": 2048,
      "pattern": "^(?:https://(?![^/?#]*@)(?![^/?#]*:)[^/?#\\s]+|http://(?:127\\.0\\.0\\.1|\\[::1\\]|localhost)(?::[0-9]+)?)(?:/[^#]*)?$"
    },
    "attribution": {
      "type": "object",
      "additionalProperties": false,
      "required": [
        "name",
        "url"
      ],
      "properties": {
        "name": {
          "type": "string",
          "minLength": 1,
          "maxLength": 120,
          "pattern": "^[^\\u0000-\\u001F\\u007F-\\u009F\\u202A-\\u202E\\u2066-\\u2069]*$"
        },
        "url": {
          "type": "string",
          "format": "uri",
          "maxLength": 2048,
          "pattern": "^(?:https://(?![^/?#]*@)(?![^/?#]*:)[^/?#\\s]+|http://(?:127\\.0\\.0\\.1|\\[::1\\]|localhost)(?::[0-9]+)?)(?:/[^#]*)?$"
        },
        "notice": {
          "type": "string",
          "maxLength": 500,
          "pattern": "^[^\\u0000-\\u001F\\u007F-\\u009F\\u202A-\\u202E\\u2066-\\u2069]*$"
        }
      }
    },
    "transport": {
      "type": "object",
      "additionalProperties": false,
      "required": [
        "kind",
        "endpoint",
        "method"
      ],
      "properties": {
        "kind": {
          "const": "https-json"
        },
        "endpoint": {
          "type": "string",
          "format": "uri",
          "maxLength": 2048,
          "pattern": "^(?:https://(?![^/?#]*@)(?![^/?#]*:)[^/?#\\s]+|http://(?:127\\.0\\.0\\.1|\\[::1\\]|localhost)(?::[0-9]+)?)(?:/[^?#\\s]*)?/v1/plugins$",
          "description": "Standard-port HTTPS, or HTTP on 127.0.0.1, ::1 or localhost at any port, without credentials, query or fragment. Endpoint must share the exact user-approved manifest origin and end in /v1/plugins. URL parsing and port validity are enforced by the consumer."
        },
        "method": {
          "const": "GET"
        }
      }
    },
    "query": {
      "type": "object",
      "description": "The endpoint query features advertised by this source. The minimal fixture uses supported=[q, category, cursor, limit], defaultLimit=50, maxLimit=50, and sorts=[]. Standard sources may declare limits through the Schema maximum of 200.",
      "additionalProperties": false,
      "required": [
        "supported",
        "defaultLimit",
        "maxLimit",
        "sorts"
      ],
      "properties": {
        "supported": {
          "type": "array",
          "minItems": 0,
          "maxItems": 7,
          "uniqueItems": true,
          "items": {
            "enum": [
              "q",
              "category",
              "capability",
              "cursor",
              "limit",
              "sort",
              "locale"
            ]
          }
        },
        "defaultLimit": {
          "type": "integer",
          "minimum": 1,
          "maximum": 200,
          "default": 50
        },
        "maxLimit": {
          "type": "integer",
          "minimum": 1,
          "maximum": 200,
          "default": 50
        },
        "sorts": {
          "type": "array",
          "maxItems": 4,
          "uniqueItems": true,
          "items": {
            "enum": [
              "relevance",
              "updated",
              "name",
              "downloads"
            ]
          }
        }
      }
    }
  }
}
