{"manifestVersion":"1.0.0","providerId":"com.hanamesh.market","name":"HanaMesh","description":"HanaMesh 目录：多源汇入的 DSH 插件与应用，可在 HanaMesh 网站认领作品。收录不代表审核或推荐。","homepage":"https://market.hanamesh.com","attribution":{"name":"HanaMesh","url":"https://market.hanamesh.com","notice":"目录数据汇入自 awesome-dsh-plugin、awesome-deepseek-harness-plugins（CC0 元数据）与 DSH 1024Store 公开 API，并保留来源回链。"},"transport":{"kind":"https-json","endpoint":"https://market.hanamesh.com/v1/plugins","method":"GET"},"query":{"supported":["q","category","cursor","limit"],"defaultLimit":50,"maxLimit":200,"sorts":[]}}
